{
  "candidates": [
    "10.246.180.244/30",
    "10.246.180.248/30",
    "10.246.180.252/30",
    "10.246.181.0/30",
    "10.246.181.4/30",
    "10.246.181.8/30",
    "10.246.181.12/30",
    "10.246.181.16/30",
    "10.246.181.20/30",
    "10.246.181.24/30",
    "10.246.181.28/30",
    "10.246.181.32/30",
    "10.246.181.36/30",
    "10.246.181.40/30",
    "10.246.181.44/30",
    "10.246.181.48/30"
  ],
  "key": 1964587664,
  "kind": "setup",
  "mtu": 1400,
  "outer_a": "192.0.2.10",
  "outer_b": "198.51.100.20",
  "pair_id": "75193a90a671ad3d",
  "rejected_cidrs": [],
  "revision": 1,
  "schema_version": 1,
  "selected_index": 0
}
